{
  "schemaVersion": 1,
  "id": "FA-PROFILE-CONF-SEQUENCE-ASTERISK-CONTINUE-001",
  "version": "1.0.0",
  "lifecycle": "required",
  "category": "sequence",
  "profile": {
    "id": "fa-ir-g1",
    "version": "0.1.0"
  },
  "input": {
    "text": "****",
    "codePoints": [
      "U+002A",
      "U+002A",
      "U+002A",
      "U+002A"
    ]
  },
  "expected": {
    "kind": "success",
    "cells": [
      "35",
      "35",
      "35",
      "35",
      "35",
      "35"
    ],
    "unicodeBraille": "⠔⠔⠔⠔⠔⠔",
    "structuralTokens": [],
    "trace": {
      "ruleIdsInOrder": [
        "FA-G1-PUNC-ASTERISK-RUN-001",
        "FA-G1-PUNC-ASTERISK-SINGLE-001"
      ]
    }
  },
  "tags": [
    "composition",
    "precedence",
    "sequence"
  ]
}
